# Activity Log

> Real-time tool call logging from stream-parser.


═══════════════════════════════════════════════════════════════
Ralph Session Started: 2026年 2月 2日 星期一 13时53分50秒 CST
═══════════════════════════════════════════════════════════════
[13:53:54] 🟢 SESSION START: model=GPT-5.2 High
[13:54:22] 🟢 TOKENS: 843 / 80000 (1%) [read:0KB write:0KB assist:0KB shell:0KB]
[13:54:23] 🟢 READ /Users/yu/trasdy/.ralph/guardrails.md (28 lines, ~2.7KB)
[13:54:23] 🟢 READ /Users/yu/trasdy/.ralph/progress.md (21 lines, ~2.0KB)
[13:54:23] 🟢 READ /Users/yu/trasdy/.ralph/errors.log (5 lines, ~.4KB)
[13:54:23] 🟢 READ /Users/yu/trasdy/RALPH_TASK.md (95 lines, ~9.2KB)
[13:54:23] 🟢 READ /Users/yu/trasdy/.ralph/activity.log (11 lines, ~1.0KB)
[13:54:43] 🟢 SHELL git status && git diff && git commit --trailer "Co-authored-by: Cursor <cursoragent@cursor.com>" -am "ralph: confirm news/data output directory exists" → exit 0
[13:54:46] 🟢 READ /Users/yu/trasdy/news/meta_data/macro_economy/2026-01-24.json (98 lines, ~9.5KB)
[13:54:47] 🟢 READ /Users/yu/trasdy/news/meta_data/macro_economy/2026-01-25.json (48 lines, ~4.6KB)
[13:54:47] 🟢 READ /Users/yu/trasdy/news/gdelt_fetcher.py (338 lines, ~33.0KB)
[13:55:12] 🟢 TOKENS: 17108 / 80000 (21%) [read:62KB write:0KB assist:1KB shell:0KB]
[13:55:48] 🟢 TOKENS: 17108 / 80000 (21%) [read:62KB write:0KB assist:1KB shell:0KB]
[13:55:54] 🟢 SHELL git status && git diff && git add RALPH_TASK.md .ralph/activity.log && git commit --trailer "Co-authored-by: Cursor <cursoragent@cursor.com>" -m "$(cat <<'EOF'
ralph: mark 2026-01-24 metadata as read

EOF
)" && git status → exit 0
[13:56:23] 🟢 TOKENS: 17171 / 80000 (21%) [read:62KB write:0KB assist:1KB shell:0KB]
[13:56:53] 🟢 TOKENS: 17171 / 80000 (21%) [read:62KB write:0KB assist:1KB shell:0KB]
[13:57:40] 🟢 TOKENS: 17258 / 80000 (21%) [read:62KB write:0KB assist:1KB shell:0KB]
[13:57:43] 🟢 SHELL python -m py_compile scripts/process_news.py → exit 0
[13:57:46] 🟢 SHELL git status && git diff && git add scripts/process_news.py .ralph/activity.log && git commit --trailer "Co-authored-by: Cursor <cursoragent@cursor.com>" -m "$(cat <<'EOF'
news: add metadata processor for zh summary and market impact

EOF
)" && git status → exit 0
[13:58:12] 🟢 SHELL python scripts/process_news.py --start-date 2026-01-24 --end-date 2026-01-24 → exit 0
[13:58:12] 🟢 TOKENS: 17258 / 80000 (21%) [read:62KB write:0KB assist:1KB shell:0KB]
[13:58:15] 🟢 READ /Users/yu/trasdy/news/data/2026-01-24.json (71 lines, ~6.9KB)
[13:58:27] 🟢 SHELL git status && git diff && git add RALPH_TASK.md news/data/2026-01-24.json .ralph/activity.log && git commit --trailer "Co-authored-by: Cursor <cursoragent@cursor.com>" -m "$(cat <<'EOF'
news: generate processed output for 2026-01-24

EOF
)" && git status → exit 0
[13:58:39] 🟢 SHELL git status && git diff && git add RALPH_TASK.md .ralph/activity.log && git commit --trailer "Co-authored-by: Cursor <cursoragent@cursor.com>" -m "$(cat <<'EOF'
ralph: mark 2026-01-25 metadata as read

EOF
)" && git status → exit 0
[13:58:42] 🟢 TOKENS: 19096 / 80000 (23%) [read:69KB write:0KB assist:1KB shell:0KB]
[13:58:50] 🟢 SHELL python scripts/process_news.py --start-date 2026-01-25 --end-date 2026-01-25 → exit 0
[13:58:52] 🟢 READ /Users/yu/trasdy/news/data/2026-01-25.json (36 lines, ~3.5KB)
[13:59:00] 🟢 SHELL git status && git diff && git add RALPH_TASK.md news/data/2026-01-25.json .ralph/activity.log && git commit --trailer "Co-authored-by: Cursor <cursoragent@cursor.com>" -m "$(cat <<'EOF'
news: generate processed output for 2026-01-25

EOF
)" && git status → exit 0
[13:59:22] 🟢 SHELL python scripts/process_news.py --start-date 2026-01-24 --end-date 2026-01-25 → exit 0
[13:59:22] 🟢 TOKENS: 19996 / 80000 (24%) [read:73KB write:0KB assist:1KB shell:0KB]
[13:59:36] 🟢 SHELL git status && git diff -- news/data/2026-01-24.json news/data/2026-01-25.json | head -200 → exit 0
[13:59:50] 🟢 SHELL git restore news/data/2026-01-24.json news/data/2026-01-25.json && git status → exit 0
[13:59:55] 🟢 TOKENS: 19996 / 80000 (24%) [read:73KB write:0KB assist:1KB shell:0KB]
[14:00:08] 🟢 SHELL git status && git diff && git add RALPH_TASK.md .ralph/activity.log && git commit --trailer "Co-authored-by: Cursor <cursoragent@cursor.com>" -m "$(cat <<'EOF'
ralph: record processing report stats for 2026-01-24..25

EOF
)" && git status → exit 0
[14:00:15] 🟢 READ /Users/yu/trasdy/RALPH_TASK.md (95 lines, ~9.2KB)
[14:00:25] 🟢 TOKENS: 22371 / 80000 (27%) [read:82KB write:0KB assist:1KB shell:0KB]
[14:00:35] 🟢 SHELL git status && git diff && git add .ralph/progress.md .ralph/activity.log && git commit --trailer "Co-authored-by: Cursor <cursoragent@cursor.com>" -m "$(cat <<'EOF'
ralph: log iteration 1 progress and outputs

EOF
)" && git status → exit 0
[14:00:39] 🟢 SHELL ls -la news/data/ → exit 0
[14:00:48] 🟢 SHELL git status → exit 0
[14:00:56] 🟢 SHELL git add .ralph/activity.log && git commit --trailer "Co-authored-by: Cursor <cursoragent@cursor.com>" -m "$(cat <<'EOF'
ralph: record test_command run

EOF
)" && git status → exit 0
[14:00:56] 🟢 TOKENS: 22371 / 80000 (27%) [read:82KB write:0KB assist:1KB shell:0KB]
[14:01:06] 🟢 SHELL git status -sb && git remote -v && git branch -vv | head -50 → exit 0
[14:01:26] 🟢 TOKENS: 22371 / 80000 (27%) [read:82KB write:0KB assist:1KB shell:0KB]
[14:02:10] 🟢 SHELL git push -u origin HEAD → exit 0
[14:02:10] 🟢 TOKENS: 22371 / 80000 (27%) [read:82KB write:0KB assist:1KB shell:0KB]
[14:02:24] 🟢 ✅ Agent signaled COMPLETE
[14:02:24] 🟢 SESSION END: 509465ms, ~22506 tokens used
[14:02:24] 🟢 TOKENS: 22506 / 80000 (28%) [read:82KB write:0KB assist:2KB shell:0KB]

═══════════════════════════════════════════════════════════════
Ralph Session Started: 2026年 2月 2日 星期一 15时01分20秒 CST
═══════════════════════════════════════════════════════════════
[15:02:39] 🟢 SESSION START: model=GPT-5.2 High
[15:02:39] 🟢 TOKENS: 750 / 80000 (0%) [read:0KB write:0KB assist:0KB shell:0KB]
[15:02:52] 🟢 READ /Users/yu/trasdy/RALPH_TASK.md (95 lines, ~9.2KB)
[15:02:52] 🟢 READ /Users/yu/trasdy/.ralph/guardrails.md (28 lines, ~2.7KB)
[15:02:52] 🟢 READ /Users/yu/trasdy/.ralph/errors.log (5 lines, ~.4KB)
[15:02:52] 🟢 READ /Users/yu/trasdy/.ralph/progress.md (35 lines, ~3.4KB)
[15:02:52] 🟢 READ /Users/yu/trasdy/.ralph/activity.log (95 lines, ~9.2KB)
[15:03:10] 🟢 TOKENS: 7348 / 80000 (9%) [read:25KB write:0KB assist:0KB shell:0KB]
[15:03:10] 🟢 READ /Users/yu/trasdy/scripts/process_news.py (316 lines, ~30.8KB)
[15:03:10] 🟢 READ /Users/yu/trasdy/news/data/2026-01-24.json (71 lines, ~6.9KB)
[15:03:10] 🟢 READ /Users/yu/trasdy/news/data/2026-01-25.json (36 lines, ~3.5KB)
[15:03:10] 🟢 SHELL git diff → exit 0
[15:03:10] 🟢 SHELL git log -10 --oneline → exit 0
[15:03:10] 🟢 SHELL git status -sb → exit 0
[15:03:41] 🟢 TOKENS: 17923 / 80000 (22%) [read:66KB write:0KB assist:0KB shell:0KB]
[15:04:02] 🟢 READ /Users/yu/trasdy/requirements.txt (7 lines, ~.6KB)
[15:04:02] 🟢 SHELL python -c "import requests; print(requests.__version__)" → exit 0
[15:05:36] 🟢 TOKENS: 18165 / 80000 (22%) [read:67KB write:0KB assist:0KB shell:0KB]
[15:05:55] 🟢 SHELL python -m py_compile scripts/process_news.py → exit 0
[15:06:16] 🟢 SHELL python scripts/process_news.py --start-date 2026-01-24 --end-date 2026-01-25 → exit 0
[15:06:16] 🟢 TOKENS: 18165 / 80000 (22%) [read:67KB write:0KB assist:0KB shell:0KB]
[15:06:29] 🟢 READ /Users/yu/trasdy/news/data/2026-01-24.json (71 lines, ~6.9KB)
[15:06:29] 🟢 SHELL python - <<'PY'
import json
from pathlib import Path

def count_sentences(s: str) -> int:
    return sum(1 for x in s.split('。') if x.strip())

for day in ['2026-01-24','2026-01-25']:
    p = Path('news/data')/f'{day}.json'
    data = json.loads(p.read_text(encoding='utf-8'))
    print(day, 'article_count', data['article_count'])
    for i,a in enumerate(data['articles']):
        sm=a['summary']; an=a['analysis']
        ok = (100<=len(sm)<=200 and 100<=len(an)<=200 and 3<=count_sentences(sm)<=5 and 3<=count_sentences(an)<=5)
        if not ok:
            print('  BAD', i, len(sm), count_sentences(sm), len(an), count_sentences(an), a['title'])
            print('   summary:', sm)
            print('   analysis:', an)
            break
    else:
        print('  OK all')
PY → exit 0
[15:06:29] 🟢 READ /Users/yu/trasdy/news/data/2026-01-25.json (36 lines, ~3.5KB)
[15:06:50] 🟢 TOKENS: 20840 / 80000 (26%) [read:77KB write:0KB assist:0KB shell:0KB]
[15:06:50] 🟢 SHELL git diff --stat → exit 0
[15:07:04] 🟢 READ /Users/yu/trasdy/.ralph/progress.md (35 lines, ~3.4KB)
[15:07:11] 🟢 SHELL date '+%Y-%m-%d %H:%M:%S %Z' → exit 0
[15:07:27] 🟢 TOKENS: 21715 / 80000 (27%) [read:81KB write:0KB assist:0KB shell:0KB]
[15:07:43] 🟢 SHELL git status → exit 0
[15:07:51] 🟢 SHELL git add scripts/process_news.py && git commit --trailer "Co-authored-by: Cursor <cursoragent@cursor.com>" -m "$(cat <<'EOF'
news: enforce 100-200 char zh summary and analysis

EOF
)" → exit 0
[15:07:55] 🟢 SHELL git add news/data/2026-01-24.json news/data/2026-01-25.json && git commit --trailer "Co-authored-by: Cursor <cursoragent@cursor.com>" -m "$(cat <<'EOF'
news: regenerate processed outputs for 2026-01-24 and 2026-01-25

EOF
)" → exit 0
[15:07:58] 🟢 TOKENS: 21715 / 80000 (27%) [read:81KB write:0KB assist:0KB shell:0KB]
[15:08:10] 🟢 SHELL ls -la news/data/ → exit 0
[15:08:13] 🟢 SHELL git status -sb && git diff → exit 0
[15:08:19] 🟢 SHELL git add RALPH_TASK.md .ralph/progress.md .ralph/activity.log && git commit --trailer "Co-authored-by: Cursor <cursoragent@cursor.com>" -m "$(cat <<'EOF'
ralph: mark news processing criteria complete and log progress

EOF
)" → exit 0
[15:08:24] 🟢 SHELL git status -sb → exit 0
[15:08:28] 🟢 TOKENS: 21715 / 80000 (27%) [read:81KB write:0KB assist:0KB shell:0KB]
